{
  "$schema": "https://json-schema.org/draft/2020-12/schema",
  "$id": "https://ivegamsft.github.io/basecoat/schemas/aidl-portfolio/project-bootstrap-manifest.schema.json",
  "title": "AIDL Portfolio Project Bootstrap Manifest",
  "type": "object",
  "required": [
    "schemaVersion",
    "fields",
    "views",
    "rules"
  ],
  "additionalProperties": false,
  "properties": {
    "schemaVersion": {
      "type": "string",
      "pattern": "^1\\.0$"
    },
    "project": {
      "type": "object",
      "additionalProperties": false,
      "properties": {
        "name": {
          "type": "string",
          "minLength": 1
        },
        "owner": {
          "type": "string",
          "minLength": 1
        },
        "description": {
          "type": "string"
        }
      }
    },
    "fields": {
      "type": "array",
      "minItems": 1,
      "items": {
        "type": "object",
        "required": [
          "name",
          "type"
        ],
        "additionalProperties": false,
        "properties": {
          "name": {
            "type": "string",
            "minLength": 1
          },
          "type": {
            "type": "string",
            "enum": [
              "single_select",
              "text",
              "number",
              "date",
              "iteration"
            ]
          },
          "required": {
            "type": "boolean"
          },
          "options": {
            "type": "array",
            "items": {
              "type": "string",
              "minLength": 1
            }
          },
          "description": {
            "type": "string"
          }
        },
        "allOf": [
          {
            "if": {
              "properties": {
                "type": {
                  "const": "single_select"
                }
              }
            },
            "then": {
              "required": [
                "options"
              ],
              "properties": {
                "options": {
                  "minItems": 1
                }
              }
            }
          }
        ]
      }
    },
    "views": {
      "type": "array",
      "items": {
        "type": "object",
        "required": [
          "name"
        ],
        "additionalProperties": false,
        "properties": {
          "name": {
            "type": "string",
            "minLength": 1
          },
          "layout": {
            "type": "string",
            "enum": [
              "BOARD",
              "TABLE",
              "ROADMAP"
            ]
          },
          "groupBy": {
            "type": "string"
          },
          "filters": {
            "type": "array",
            "items": {
              "type": "string"
            }
          },
          "description": {
            "type": "string"
          }
        }
      }
    },
    "rules": {
      "type": "array",
      "items": {
        "type": "object",
        "required": [
          "id",
          "name"
        ],
        "additionalProperties": false,
        "properties": {
          "id": {
            "type": "string",
            "minLength": 1
          },
          "name": {
            "type": "string",
            "minLength": 1
          },
          "description": {
            "type": "string"
          },
          "mode": {
            "type": "string",
            "enum": [
              "advisory",
              "enforced"
            ]
          },
          "required": {
            "type": "boolean"
          }
        }
      }
    }
  }
}
